doc_id,pub_title,authors,SEFA_authors,pub_date,publication_link,author_links,keywords_list,abstract
16,Do Female Board Members Influence Corporate Social Responsibility Performance?,"Isaiah Oino, Jonathan Liu",['Isaiah Oino'],Jul 2022,https://pureportal.coventry.ac.uk/en/publications/do-female-board-members-influence-corporate-social-responsibility,['https://pureportal.coventry.ac.uk/en/persons/isaiah-oino'],"['Corporate', 'social', 'responsibility', 'performance', 'female']","Caring for the environment has become everyone’s responsibility because of our significant negative impact. Considering this, companies are spending a substantial amount on corporate social responsibility (CSR) activities not only as part of corporate citizenship but also to enhance corporate image. Using a fixed-effect model on 2,260 companies’ annual data from 2012 to 2017, we analyze whether female board members influence CSR performance. The results indicate that the proportion of female board directors (PFBD) in Chinese firms is relatively small compared with the male. In other words, the boards members are predominantly male. The fixed effects model indicates that both the number and proportion of female directors are significant in influencing CSR performance. Surprisingly, we note that the average age of female board directors has a significant and negative impact on CSR performance. The results also indicate that the education level of the female director does play a significant role in CSR performance. This demonstrates that firms need to recruit educated board directors and with a right mix of age."
17,Do non-communicable diseases influence sustainable development in Sub-Saharan Africa? A panel autoregressive distributive lag model approach,"Judith Kabajulizi, Francis Awuku Darko","['Judith Kabajulizi', 'Francis Awuku Darko']",Mar 2022,https://pureportal.coventry.ac.uk/en/publications/do-non-communicable-diseases-influence-sustainable-development-in,"['https://pureportal.coventry.ac.uk/en/persons/judith-kabajulizi', 'https://pureportal.coventry.ac.uk/en/persons/francis-darko']","['Non-communicable diseases,', 'disability-adjusted life years,', 'sustainable development', 'adjusted net savings', 'panel ARDL', 'Sub-Saharan Africa']","The burden of non-communicable diseases (NCDs) in Sub-Saharan Africa has been on the surge during the last two decades. This study examines the relationship between NCDs, measured by disability adjusted life years (DALYs), and sustainable development in Sub-Saharan African (SSA) countries. We adopt a panel Autoregressive Distributed Lag model to evaluate the association between NCDs and sustainability of development, alternately measured by adjusted net savings and gross domestic savings, in 24 SSA countries, from 1990 to 2017. The results show that NCDs adversely affect sustainable development in the long run. The findings demonstrate an urgent need to mitigate the rapidly rising burden of NCDs. We argue that reducing the current trend of NCDs in the sub-region is necessary for countries to be on a sustainable development trajectory."
18,Editorial: New developments in corporate governance research,Loai Alsaid,['Loai Alsaid'],21 Jun 2022,https://pureportal.coventry.ac.uk/en/publications/editorial-new-developments-in-corporate-governance-research,['https://pureportal.coventry.ac.uk/en/persons/loai-alsaid'],"['Corporate Governance', 'New Developments']", 
19,Evolution of research in finance over the last two decades – A topographical view,"Yasser Alhenawi, M. Kabir Hassan, Rashedul Hasan",['Rashedul Hasan'],Jan 2022,https://pureportal.coventry.ac.uk/en/publications/evolution-of-research-in-finance-over-the-last-two-decades-a-topo,['https://pureportal.coventry.ac.uk/en/persons/rashedul-hasan'],"['Finance', 'Literature review', 'Purposive sampling', 'Qualitative analysis', 'Topographical map']","A standard literature review focuses on the historical development of a particular topic. In contrast, the novel approach introduced in this study constructs a topographical map demarcating the relative importance, dispersion, and interrelationship among many finance topics. The final product is a bird’s eye view of the whole literature illustrating historical trends, concentrations, and territories. We apply qualitative analysis, purposive sampling, and syntactic analysis to 34,261 articles published in 52 journals over the past two decades. First, we analyze the proliferation and historical development of topics. We find that a few topics (e.g., insurance) are losing ground to newer ones (e.g., blockchain and digital currency). However, several topics seem to occupy a stable, sizeable portion of finance literature (e.g., investment strategies and portfolio management). Next, we analyze the relationship between topics and journals and report strong tendencies that are not always confined by the traditional scope of journals. For instance, papers addressing investment strategy and portfolio management issues seem to appear in numerous journals; while special topics such as blockchain, digital currencies, dividends, and real estate can only be found in a limited number of journals. We also report strong interdependence among topics. More than a third of the papers screened in this study discuss two topics or more. We identify a list of topics that are likely to be investigated jointly. Overall, our work demonstrates the historical evolution of the entire finance literature; and identifies fertile areas for future research."
20,Financial contagion effects of major crises in African stock markets,"Jaliyyah Bello, Jiaqi Guo, Mohammad Khaleq Newaz","['Jaliyyah Bello', 'Mohammad Khaleq Newaz']",Jul 2022,https://pureportal.coventry.ac.uk/en/publications/financial-contagion-effects-of-major-crises-in-african-stock-mark,"['https://pureportal.coventry.ac.uk/en/persons/jaliyyah-bello', 'https://pureportal.coventry.ac.uk/en/persons/mohammad-khaleq-newaz']","['Financial crisis', 'Contagion effect', 'African stock markets']","This study examines financial contagion effects in African stock markets during major crises over the period 2005 to 2020. We investigate contagion effects in individual stock markets and from a regional perspective using dynamic conditional correlations during the global financial crisis, European debt crisis, Brexit, and COVID-19. The empirical evidence confirms contagion effects in some individual markets. However, significant evidence of contagion is found only during the global financial crisis from the regional perspective. Our findings suggest that the regional impacts of crises differ due to the nature of those crises. We also find financial contagion increases in the country-level risk, market capitalization and export to GDP and decreases in corruption."
21,Future of education and research: a preliminary thematic analysis ,Simon Huston,"['Simon Huston', 'Huston, S.']",2 May 2022,https://pureportal.coventry.ac.uk/en/publications/future-of-education-and-research-a-preliminary-thematic-analysis,"['https://pureportal.coventry.ac.uk/en/persons/simon-huston', 'https://pureportal.coventry.ac.uk/en/persons/simon-huston']","['educational improvement', 'research foresight', 'manipulation', 'credentialisation', 'managerialism', 'commodification', 'phronesis']","There seems to be crisis in education and research.  The education landscape looks fragmented, expensive and yet fails millions.  A common perception is that, armed with cultural and social capital, the ‘sharp elbows of the middle classes’ game a commodified system to amass credentials. The media rails against learning institutions that inflate grades to cover up failings.  Some academics game the system or churn out indigestible papers of negligible practical social impact.  In an effort to unravel some of these issues and sketch the future of education and research, the study conducted a preliminary exploratory thematic investigation.  First, it chose six credible institutions in the field.  A brief review of associated web content chose prominent ‘sound bites’. In Phase II, the author identified relevant journal articles, initially using the search term <Future education research>.  Rather than structured or systematic, the review was focused.  Finally, in Phase III, the inquiry creatively and interactively grouped the collected secondary martial into themes, underpinned by reflection on decades of embedded teaching experience in a dozen schools or colleges and seven universities.  The convenience sampling and judgemental analysis generated ten themes from recent seminal discourse on the future of education and research: TENSION PARADOX,ECOSYSTEM ENRICHMENT, PHRONESIS vs. COMMODIFICATION, ACCESS vs. ELITECREDENTIALISATION, STRATEGIC COLLABORATION, NURTURING EMOTIONAL & SOCIALWELLBEING, FUNDING/RECONFIGURING CAPITALISM, JUDICIOUS TECHNOLOGY, INVESTMENTIN PEOPLE, DEMOCRATISING DIALOGUE.  The most salient dimensions were PHRONESIS vs. COMMODIFICATION and STRATEGICCOLLABORATION.  In effect, much recent managerialist educational reform (notwithstanding its transformative gloss)seems, actually, fundamentally misguided. Second, impactful research in, for example, deep tech, resilience or health calls for strategic interdisciplinary collaboration."
22,Gender Diversity and Financial Statement Fraud,"Yang Wang, Mei Yu, Simon Gao",['Mei Yu'],1 Mar 2022,https://pureportal.coventry.ac.uk/en/publications/gender-diversity-and-financial-statement-fraud,['https://pureportal.coventry.ac.uk/en/persons/mei-yu'],"['Gender diversity', 'Financial statement fraud', 'Bivariate probit model', 'Anti-corruption campaign', 'State-owned enterprises']","This study investigates the role of gender diversity in fraud commission and detection with a view to identifying whether companies with more female corporate leaders are less likely to be involved in financial statement fraud. Using a bivariate probit model, the role of female corporate leaders in financial statement fraud commission and detection is examined for Chinese listed companies from 2007 to 2018. The representation of female corporate leaders increases the likelihood of fraud detection, thus reducing firms’ propensity to engage in fraud. The finding confirms that women are risk averse and more committed to ethical practices than men in corporate leadership positions. Moreover, this impact of gender diversity is contingent upon the nature of ultimate controllers of listed companies: more female representation in top leadership roles can mitigate fraud commission or detect fraud effectively in non-state-owned enterprises, but not in state-owned enterprises. In addition, the recent anti-corruption campaign initiated by Chinese President Jinping Xi is a powerful form of public governance. Female corporate leaders play a more positive role in mitigating fraud commission and detecting fraud commission in the post-campaign period than in the pre-campaign period."
23,IFRS 8 and the cost of capital in Europe,"Ahmed Saleh, Ahmed Aboud, Yasser Eliwa",['Ahmed Saleh'],19 Jan 2022,https://pureportal.coventry.ac.uk/en/publications/ifrs-8-and-the-cost-of-capital-in-europe,['https://pureportal.coventry.ac.uk/en/persons/ahmed-saleh'],"['IFRS 8', 'segment reporting quality', 'the cost of debt capital', 'the cost of equity capita', 'the European Union', 'the management approach']","This study examines segment reporting information usefulness after the adoption of IFRS 8 in 18 European Union countries. Specifically, 1) we introduce a new comprehensive measure of segment reporting quality that reflects four different dimensions of segment information, 2) we investigate the impact of segment reporting quality on the cost of equity and debt capital after the adoption of IFRS 8, and 3) we investigate the moderating role of the country-level enforcement system on the association between segment reporting quality and the cost of equity and debt capital after the adoption of IFRS 8. Using a self-constructed segment reporting quality measure and a sample of 884 firm-year observations over the period of 2007 to 2011, we provide evidence that investors and lending institutions find no change in the usefulness of segment reporting after the adoption of IFRS 8. Our study is original in using a comprehensive measure of segment reporting quality. Furthermore, our study is the first to examine the relationship between segment reporting quality and the cost of debt capital after the adoption of IFRS 8 and the moderating role of the country-level enforcement system. Our findings provide useful insights to regulator and accounting standard-setting bodies about segment reporting."
24,Interbank liquidity risk transmission to large emerging markets in crisis periods,"Imtiaz Sifat, Alireza Zarei, Mehdi Hosseini, Elie Bouri","['Alireza Zarei', 'Mehdi Hosseini']",Jul 2022,https://pureportal.coventry.ac.uk/en/publications/interbank-liquidity-risk-transmission-to-large-emerging-markets-i,"['https://pureportal.coventry.ac.uk/en/persons/alireza-zarei', 'https://pureportal.coventry.ac.uk/en/persons/mehdi-hosseini']","['Credit risk', 'Liquidity risk', 'Bond market', 'Stock market', 'BRICS', 'TED', 'US VIX']","In this paper, we conduct two investigations regarding funding liquidity risk in large emerging economies: Brazil, Russia, India, China, and South Africa — BRICS. In the first, we track the relevance of monetary policy decisions originating in developed economies for interbank funding liquidity risk in BRICS economies during crisis periods by applying a time-varying parameter model in a Bayesian framework. The results indicate weak associations between interbank credit market and monetary policy and market conditions in the US. In contrast, the Federal Reserve's National Financial Conditions Index (NFCI) — a representative of the health of both real and financial sectors in the US — matters more. The temporal patterns of the results imply that key central banking decisions precede or coincide with low degrees of associations. In the second, we examine whether interbank credit crunch exerts an influence on market liquidity risk in BRICS economies using a Granger causality approach. The results reveal that interbank credit crunch depresses market liquidity in the corresponding domestic market and that the state of fear and credit market conditions in the US exert some influence in this regard. Overall, our findings hint at judicious market intervention and liquidity management by BRICS central banks."
25,Kuala Lumpur - from a tin mining settlement to a neoliberal stronghold of Southeast Asia,"Marek Kozlowski, Simon Huston",['Simon Huston'],22 Feb 2022,https://pureportal.coventry.ac.uk/en/publications/kuala-lumpur-from-a-tin-mining-settlement-to-a-neoliberal-strongh,['https://pureportal.coventry.ac.uk/en/persons/simon-huston'],"['Thematic analysis', 'Urban planning', 'Colonial legacies']","Purpose: Kuala Lumpur (KL) emerged as the capital of the newly independent Federation of Malayan States in 1957 with a population of 316,000. Over the next 60 years, the city expanded into a major urban regional conurbation. It now covers an area of 2,790 km
              2 and has a population of around 7.7 million. In the last two decades, market-driven, fast-track development, underpinned by road infrastructure has accelerated the city's urban transformation. Especially over the last two decades, a spate of urban redevelopments, including commercial and retail complexes, specialised centres, industrial parks, educational complexes and residential estates have transformed the Kuala Lumpur Metropolitan Region (KLMR) beyond recognition. KL is only one example among many of intensive Southeast Asian property-led urban development, fuelled by demographic pressures and global capital inflows that transformed the regional natural and built environments. The purpose of this study is to investigate the influence of globalisation, neoliberalism and property-led development, on the built form and socio-cultural legacies of the KLMR. Design/methodology/approach: The major aim of this study is to determine how neoliberalism and property-led development have impacted the urban form and structure of the KLMR. The methodology applied in this study concentrates mainly on the use of qualitative research methods. The major qualitative research methods include qualitative analysis, field surveys and observations, primary and secondary data collection. The approach in this study is to exemplify the shift from government-sponsored development in the post-independence period to the current globalised-private oriented development. Findings: The major findings of this research suggest that the global, property-led mode of urban development, whilst superficially successful, undermined traditional and tropical-climate urban landscapes. It also bequeathed many urban or property level problems, including traffic congestion, air pollution, planning governance and building management issues. The paper outlines narratives for a more balanced and sustainable mode of urban development, which is more in tune with local culture and climatic conditions. Originality/value: This paper provides a deep insight analysis and evaluation of KL's growth from a small town into a global metropolitan region where property-led development dictates the rules and determines the character of the city.
            "
26,Measuring the impact of corporate governance on non-financial reporting in the top HEIs worldwide,"Mahalaxmi Adhikari Parajuli, Mehul Chhatbar, Abeer Hassan",['Mehul Chhatbar'],12 May 2022,https://pureportal.coventry.ac.uk/en/publications/measuring-the-impact-of-corporate-governance-on-non-financial-rep,['https://pureportal.coventry.ac.uk/en/persons/mehul-chhatbar'],"['Non-financial reporting', 'higher education institutions,', 'neo-institutional theory', 'panel data', 'Corporate Governance']","Purpose – This study aims to measure the relationship between corporate governance and Non-Financial Reporting (NFR) in Higher Education Institutions (HEIs). Board effectiveness, student engagement, audit quality, Vice-Chancellors (VC) pay, and VC gender are targeted for analysis.Design/methodology/approach – This study is based on content analysis. We used the EU NFR Directive (2014/95/EU) to measure NFR. This includes environmental, corporate social responsibility, human rights, corporate board effectiveness, and corruption and bribery. Cross sectional data was collected form 89 HEIs worldwide across 15 different countries over three years. Content analysis, the weighted scoring method and panel data analysis are employed to obtain the results.Findings – Through a neo-institutional theoretical lens, this study provides a broader understanding of NFR content disclosure practices within HEIs. Our findings reveal that the audit quality, VC pay, and VC gender are significantly and positively associated with NFR content disclosure. However, board effectiveness has a significant negative impact on NFR content disclosure. More interestingly, our findings reveal that student engagement has an insignificant association with NFR content disclosure and there significant difference on the level of NFR content disclosure across universities situated in different geographical region such as USA, Australia, UK, and EU, Asia & Canada. Our findings have important implications for regulators and policymakers. Our evidence appears to be robust when controlling for possible endogeneities.Originality/value – The study contributes to the literature on corporate non-financial disclosure as it provides new insights of corporate governance mechanism and NFR disclosure within HEIs."
27,Middle Eastern Extinctions: Building a Religious Motivation for Species Protection,"Tariq Al Montaser, Jill Atkins, Ali Elfadli, Abdullah Eskandarany, Abeer Hassan, Omar Mowafi, Simon Norton, Mohamed Saeudy",['Tariq Al Montaser'],30 May 2022,https://pureportal.coventry.ac.uk/en/publications/middle-eastern-extinctions-building-a-religious-motivation-for-sp,['https://pureportal.coventry.ac.uk/en/persons/tariq-al-montaser'],[],"he extinction and biodiversity accounting literature focused initially on developed economies including the UK and Europe, spreading recently to research on Africa, especially South Africa, China and other countries in the Far East. The Middle East, however, has not received attention in the academic literature. Furthermore, there seems to be less information readily available on species extinction and biodiversity degradation in Middle Eastern countries. In this chapter, we address species extinctions in Saudi Arabia, Jordan and Libya to provide insights into the situation in these countries, problems and issues arising, as well as potential solutions. The authors present the causes of species extinctions in the Middle East as well as provide information on some of the initiatives underway to prevent extinctions. Whilst most of this book focuses on motivations for species protection grounded in financial materiality, accountability, legitimacy and ethics, this chapter builds a religious rationale, indeed imperative, for species protection and biodiversity conservation. Part I of this chapter discusses the status of threatened species in Saudi Arabia, providing an understanding of the importance of religion as a rationale for species protection. In Part II, the status of threatened species in Jordan is discussed. Part III provides detailed interview evidence on the deterioration of biodiversity in Libya and for enhanced species protection.evidence on the deterioration of biodiversity in Libya and the need for enhancedspecies protection."
28,Non‑executive employee ownership and financial reporting quality: evidence from Europe,"Sami Adwan, Alaa Alhaj Ismail, Ranko  Jelic",['Alaa Alhaj Ismail'],22 Apr 2022,https://pureportal.coventry.ac.uk/en/publications/nonexecutive-employee-ownership-and-financial-reporting-quality-e,['https://pureportal.coventry.ac.uk/en/persons/alaa-alhaj-ismail'],"['Financial reporting quality', 'Rank and fle employees', '· Earnings management ·', 'Employee ownership']","This paper examines the association between non-executive employee shareholding and financial reporting quality. The analysis is conducted using a sample of non-financial firms listed in eleven European countries between 2006 and 2017. We find a positive association between non-executive employee ownership and financial reporting quality. Furthermore, we find this positive association to be more pronounced for firms operating in the following settings: higher labour union density, more industry peer firms and more flexible labour market regulations. Overall, these findings support the view that employee shareholding enhances the quality of financial reporting by aligning the interests of employees with those of shareholders through two channels: reduced agency problems and enhanced employee retention. Our study contributes to the research on the impact of ownership characteristics on financial reporting incentives. It underscores the role non-executive employee ownership can play in improving a firm’s corporate governance and therefore the quality of financial reporting."
29,Price run-ups and insider trading laws under different regulatory environments,"Styliani (Elina) Panetsidou, Angelos Synapis, Ioannis Tsalavoutas","['Styliani (Elina) Panetsidou', 'Angelos Synapis']",Aug 2022,https://pureportal.coventry.ac.uk/en/publications/price-run-ups-and-insider-trading-laws-under-different-regulatory,"['https://pureportal.coventry.ac.uk/en/persons/styliani-elina-panetsidou', 'https://pureportal.coventry.ac.uk/en/persons/angelos-synapis']","['Price run-ups', 'Takeovers', 'Insider trading laws', 'Alternative investment market (AIM)', 'Main market (MM)']","We examine target firms’ price run-ups prior to takeovers in two different exchange regulatory environments within the same country. We show that target firms listed both in the secondary market of the UK, known as the Alternative Investment Market (AIM), and in the traditionally regulated Main Market, experience significant abnormal stock returns prior to takeover announcements. These results persist after controlling for market anticipation, indicating signs of information leakage. Contrary to the narrative that secondary markets may be more susceptible to market abusive behaviors, we find that the AIM targets experience significantly lower pre-announcement returns. In addition, we do not find support that the introduction of stricter laws reduces the price run-ups in any of the two markets. In sharp contrast, we find support that the enforcement of insider trading laws, through criminal convictions, reduces the pre-announcement abnormal stock returns but only in the market in which the enforcement focuses."
